{
  "schema_version": 1,
  "conversation_id": "chat_demo",
  "task_id": "task_demo_voice_docs",
  "primary_agent_run_id": "agent_run_demo_01",
  "attempt_id": "attempt_demo_01",
  "ordinal": 1,
  "resumes_attempt_id": null,
  "provider_session_id": "provider_task_session_demo_01",
  "state": "completed",
  "context_version": 7,
  "slot_lease": {
    "status": "released",
    "lease_id": "primary_slot_chat_demo",
    "acquired_at": "2026-08-02T12:00:59Z",
    "released_at": "2026-08-02T12:25:00Z",
    "release_reason": "The primary submitted a completion candidate and released execution authority.",
    "release_receipt_id": "slot_release_receipt_attempt_demo_01"
  },
  "writer_lock_ids": [],
  "capability_lease_ids": [],
  "checkpoint_ref": {
    "kind": "completion_candidate",
    "id": "completion_candidate_voice_docs"
  },
  "failure": null,
  "created_at": "2026-08-02T12:00:55Z",
  "updated_at": "2026-08-02T12:25:00Z",
  "terminal_at": "2026-08-02T12:25:00Z"
}
